Company_Brand,HeadQuarter,Sector,What_it_does,Amount,Stage,Stage_category,Funding_year,Sector_category
Pencilton,Hyderabad,FinTech,"India's first app for kids & teens to manage and spend pocket money while learning about money in a fun, gamified way.",330000.0,Pre-seed,Pre-seed,2021,Financials
Bandhoo,Gurugram,IT,"Bringing ease of eCommerce to Construction for builders, infrastructure companies, contractors and workers",1000000.0,Seed,unknown,2021,Information Technology
ixigo,Gurugram,IT,"AI-based travel app offering seamless planning and booking for flights, trains, buses, hotels and more!",53000000.0,Seed,unknown,2021,Information Technology
The Whole Truth,Mumbai,Food & Beverages,"Believe simple, homely ingredients, minimally processed, are the secret to nutritious, tasty food",6000000.0,Series A,Series A,2021,Consumer Discretionary
Insane AI,Bangalore,Fitness,Mainstream fitness formats are a primitive solution to the modern problems of a sedentary lifestyle.,800000.0,Seed,Seed,2021,Consumer Discretionary
Droom,Gurugram,Automobile,"Droom is an AI and data science driven online transactional platform, which offers 21st century experience in buying & selling used & new automobiles in India",200000000.0,Seed,unknown,2021,Consumer Discretionary
Skymet,Noida,Environmental Services,Provide services that allow clients to understand and organize themselves around changing environment.,1000000.0,Seed,unknown,2021,Information Technology
Go Swift,Bangalore,Consumer Services,Help small & medium sized businesses to grow by helping them with their shipping requirements at the cheapest and most reliable service.,2000000.0,Pre-series A,Pre-seed,2021,Consumer Discretionary
Mamaearth,Gurugram,Healthcare,A brand which develops products from world-class research and attempts to solve every little problem that we as parents face.,50000000.0,Seed,unknown,2021,Health Care
G.O.A.T,Bangalore,D2C,G.O.A.T Brand Labs provides a tech-enabled platform for D2C brands to scale.,36000000.0,Series A,Series A,2021,Consumer Discretionary
ReDesyn,Mumbai,Merchandise,"Merchandise drop-shipping platform for influencers, designers, creators & brands.",300000.0,Pre-series A,Pre-seed,2021,Consumer Discretionary
Inspacco,Pune,Facilities Services,"For residential commercial and industrial establishments , Inspacco is a one stop solution , that delivers affordable improvement and maintenance services",200000.0,Seed,unknown,2021,unknown
Knorish,Gurugram,EdTech,"Saas platform offers a feature packed platform enables businesses, experts, professionals, artists, instructors, specialists, coaches, people seeking work from home opportunities",1000000.0,Pre-series A,Pre-seed,2021,Information Technology
Dozee,Bangalore,Healthcare,"Dozee is India's only contactless health monitor that silently tracks your heart, respiration, sleep patterns, stress levels, cardiac contractions, apnea and more while you sleep.",5000000.0,Series A,Series A,2021,Health Care
BlackBuck,Bangalore,Logistics & Supply Chain,BlackBuck marks the beginning of a new path in trucking. A path that is organized and makes trucking simple for every shipper and trucker.,67000000.0,Series E,"Series B,C,D&E",2021,Industrial
Mailmodo,Bangalore,Marketing & Advertising,Mailmodo is a complete email marketing solution enabling users to create and send app-like interactive emails to improve email conversions.,2000000.0,Seed,Seed,2021,Consumer Discretionary
NirogStreet,New Delhi,Healthcare,Nirogstreet as a concept is working to make #Ayurveda first call of treatment.,2500000.0,Series A,Series A,2021,Health Care
Even,Bangalore,Healthcare,One monthly subscription to cover all your healthcare needs.,5000000.0,Seed,Seed,2021,Health Care
Captain Fresh,Bangalore,Logistics,A B2B marketplace leveraging technology to deliver the fastest harvest-to-retail in the industry.,12000000.0,Series A,Series A,2021,Industrial
Otipy,Gurugram,Food & Beverages,Otipy helps the farmer to deliver farm fresh vegetables & fruits at doorstep.,10200000.0,Series A,Series A,2021,Consumer Discretionary
Lenskart,Faridabad,Eyewear,India's fastest growing eyewear company and largest eyewear company online.,220000000.0,Seed,unknown,2021,Consumer Discretionary
Eka.care,Bangalore,Healthcare,A digitally enabled and connected healthcare ecosystem for better health outcomes.,4500000.0,Seed,unknown,2021,Health Care
Braingroom,Chennai,EdTech,"BrainGroom is an online marketplace for educational, recreational & wellness classes with defined target segment, quantifiable outcomes & specified time duration.",200000.0,Seed,unknown,2021,Information Technology
Edvizo,Bangalore,Consumer Services,"Edvizo is an online marketplace to help students and parents find, compare and enroll in the best and trusted private institutes in their locality",1000000.0,Pre-series A,Pre-seed,2021,Consumer Discretionary
Credenc,New Delhi,FinTech,An education loan platform to finance meritorious students for the college expenses by underwriting future employability,25000000.0,Seed,unknown,2021,Financials
GlobalBees,New Delhi,D2C Business,Globalbees partners with entrepreneurs who have built an online-first business.  Our team scales up D2C businesses in India and abroad.,150000000.0,Series A,Series A,2021,Consumer Discretionary
Spinny,Gurugram,Automotive,Spinny is a new age used car end-to-end platform in India.,108000000.0,Series D,"Series B,C,D&E",2021,unknown
Mynvax,Bangalore,Biotechnology,Mynvax is a pre-clinical stage vaccine biotechnology. Current develop programs include a recombinant vaccine for human influenza and COVID19.,4000000.0,Series A,Series A,2021,Health Care
RiseBird,Pune,Human Resources,RiseBird provides on-demand 2.5K + expert video interviews and A.I. powered insights to help companies hire online.,500000.0,Seed,unknown,2021,unknown
Uvi Health,Bangalore,Healthcare,Digital health platform delivering personalized care for women’s sexual and reproductive health concerns,330000.0,Pre-seed,Pre-seed,2021,Health Care
Vegrow,Bangalore,Farming,Vegrow is in the business of fresh fruits & vegetables with addressable market size of $43 Billion.,13000000.0,Seed,unknown,2021,unknown
Automovill,Bangalore,Automotive,"Automovill is a unique platform to aggregate automobile service providers, where we connect vehicle owners with all kind of automobile service providers under one roof.",500000.0,Seed,unknown,2021,unknown
HealthifyMe,Bangalore,Healthcare,HealthifyMe is a revolutionary health and fitness application that is on a mission to transform a billion lives!,75000000.0,Series C,"Series B,C,D&E",2021,Health Care
GalaxyCard,Gurugram,FinTech,GalaxyCard is a mobile based Instant Credit Card.,450000.0,Seed,unknown,2021,Financials
Bella Vita Organic,Gurugram,Healthcare,Bella Vita Organic or ‘The Good Life’ is dedicated to creating handcrafted and organic beauty solutions inspired by the natural elements of the earth and age old beauty best practices.,10000000.0,Seed,unknown,2021,Health Care
SmartCoin,Bangalore,FinTech,India's Most Preferred Instant Loan App,10000000.0,Seed,unknown,2021,Financials
MYSUN,New Delhi,Solar,"India's Largest Online Rooftop Solar Platform for SMEs, Industries & Homes",2000000.0,Seed,unknown,2021,unknown
Sea6 Energy,Bangalore,Biotechnology,"Sea6 Energy envisions a future where the abundant oceans will be our biomass farms of tomorrow - to provide solutions in energy, agriculture and food.",9000000.0,Series B,"Series B,C,D&E",2021,Health Care
Beco,Mumbai,Consumer Goods,"Eco-friendly home and kitchen care products that are plastic-free, high in quality and affordable.",500000.0,Seed,Seed,2021,Consumer Discretionary
OneCode,Bangalore,Internet,"OneCode is a platform which connects new age digital first brands with ""relevant"" sellers (aka OneCoders) to sell their products and services",5000000.0,Seed,unknown,2021,Information Technology
MedPay,Bangalore,Information Technology,MedPay® is building the real-time claims adjudication platform for health insurers.,1200000.0,Seed,Seed,2021,Information Technology
Inshorts,Noida,Internet,Built Inshorts with a promise to deliver news,60000000.0,Seed,unknown,2021,Information Technology
Digantara,Bangalore,SpaceTech,"Digantara is an Indian Space Technology Company incubated at Indian Institute of Science (IISc), establishing a space-based surveillance platform with global realtime earth coverage",2500000.0,Seed,Seed,2021,unknown
Aqgromalin,Chennai,AgriTech,Aqgormalin is a tech driven farm diversification platform enabling farmers to diversify into Animal Husbandry and Aquaculture.,700000.0,Seed,Seed,2021,Information Technology
Square Yards,Gurugram,Real Estate,India’s largest tech enabled Real Estate Brokerage and Mortgage Marketplace,25000000.0,Seed,unknown,2021,Consumer Discretionary
OYO,Gurugram,Hospitality,OYO is a global platform that empowers entrepreneurs and small businesses with hotels and homes by providing full-stack technology,660000000.0,Seed,unknown,2021,Health Care
Ola Electric,Bangalore,Automotive,Ola Electric - The future of mobility is here.? Charging ahead to accelerate the world’s transition to sustainable mobility.,100000000.0,Debt,Others,2021,unknown
Bikry app,Noida,Consumer software,"Bikry, a Direct-to-Customer platform to start your online store within 30 seconds at 0% commission",1300000.0,Seed,unknown,2021,Consumer Discretionary
Oliveboard,Bangalore,EdTech,Oliveboard is the top exam preparation platform for Banking & Government Exams.,3000000.0,Seed,unknown,2021,Information Technology
Trell,Bangalore,Social commerce,India's Largest Lifestyle Social Commerce platform. Empowering millions of storytellers & Micro-Entrepreneurs.,45000000.0,Series B,"Series B,C,D&E",2021,unknown
Kredent,Kolkata,EdTech,Kredent Academy is the unique concept where financial market professionals have taken the onus of creating a strong knowledge bank in their area of expertise,1000000.0,Seed,unknown,2021,Information Technology
EasyAspataal,Mumbai,Healthcare,India’s First Digital Admission Desk for Hospitalisation.,500000.0,Seed,Seed,2021,Health Care
Pankhuri,Bangalore,Social community,"Pankhuri is a women's only community for members to socialize, explore and upskill through live interactive courses, expert chat and interest-based clubs.",3200000.0,Seed,unknown,2021,Communication Services
Arcana,Bangalore,Information Technology,Arcana is the Storage Layer of Ethereum.,370000.0,Seed,Seed,2021,Information Technology
Aquaconnect,Chennai,Fishery,Aquaconnect is a global full-stack aquaculture technology venture that provides data-driven farm advisory and marketplace solutions to fish and shrimp farmers,4000000.0,Pre-series A,Pre-seed,2021,unknown
Vah Vah!,Bangalore,EdTech,A mission to educate India and make its young and dynamic population job ready.,1800000.0,Seed,unknown,2021,Information Technology
LetsDressUp,Gurugram,Apparel & Fashion,Building India's version of Stitch Fix,300000.0,Pre-series A,Pre-seed,2021,Consumer Discretionary
Sapio Analytics,Mumbai,Computer software,Aim to provide the most intelligent AI-powered policy making solutions for government institutions across the world.,150000.0,Seed,unknown,2021,Information Technology
Pratilipi,Bangalore,Online storytelling,"Pratilipi is the largest Indian language self-publishing platform with over 350,000 authors and more than 28,000,000 unique monthly readers.",48000000.0,Seed,unknown,2021,unknown
Ati Motors,Bangalore,Automotive,Autonomous industrial vehicle maker,35000000.0,Pre-series A,Pre-seed,2021,unknown
peAR,Mumbai,Deeptech,An AR / VR tech based Start-up in Mumbai.,300000.0,Pre-series A,Pre-seed,2021,unknown
Gourmet Garden,Bangalore,Farming,"100% contamination free, pesticide free naturoponically grown vegetables.",3000000.0,Seed,unknown,2021,unknown
The Sleep Company,Mumbai,Consumer Goods,Patent Pending sleep technology developed by actual Rocket Scientists and sleep experts after years of research.,1000000.0,Pre-series A,Pre-seed,2021,Consumer Discretionary
ION Energy,Mumbai,Automotive,Advanced Electronics & Software Supplier for Electric Vehicles & Battery Energy Storage,3600000.0,Pre-series A,Pre-seed,2021,unknown
Digit Insurance,Bangalore,Insuretech,"Digit becomes the first Unicorn of 2021, valued at $1.9B.",200000000.0,Seed,unknown,2021,unknown
FRAAZO,Mumbai,Food & Beverages,FRAAZO is Mumbai's favourite App for Fresh Vegetables and Fruits coming straight from the Farm to your Doorstep within 18 Hours.,11000000.0,Series A,Series A,2021,Consumer Discretionary
Licious,Bangalore,Food & Beverages,"Licious is a consumer food company, focussed at delighting the world with an unmatched range of meat & meat products.",192000000.0,Series F,Others,2021,Consumer Discretionary
WinZO,New Delhi,Gaming,WinZO is the largest social gaming and entertainment platform in India.,65000000.0,Series C,"Series B,C,D&E",2021,Consumer Discretionary
Furlenco,Bangalore,Consumer Goods,Furlenco is a different furniture company.,100000000.0,Seed,unknown,2021,Consumer Discretionary
Skylark Drones,Bangalore,Aviation,"Enterprise drone solutions that help plan, build, and sustain the world we live in.",3000000.0,Pre-series A,Pre-seed,2021,Industrial
TWID,Bangalore,FinTech,"TWID is shaping the future of Digital Currencies, delivering new-age fintech solutions",2500000.0,Seed,unknown,2021,Financials
MyMobiForce,Noida,Internet,"Crowdsourcing platform imparting best-in-class services with immensely talented, skilled & qualified workforce pan-India",1400000.0,Pre-series A,Pre-seed,2021,Information Technology
Pine Labs,Noida,Information Technology,A merchant platform company that provides financing and last-mile retail transaction technology to merchants,600000.0,Seed,unknown,2021,Information Technology
Genworks Health,Bangalore,Healthcare,GENWORKS Health is an initiative by GE for empowering healthcare professionals operating in the rural areas to deliver better medical facilities and diagnostics while keeping things affordable.,2000000.0,Seed,unknown,2021,Health Care
Neverinstall,Bangalore,Information Technology,A cloud platform to bring any GUI application regardless of OS and Device type to the browser.,370000.0,Seed,Seed,2021,Information Technology
BeatO,New Delhi,Healthcare,ULTIMATE app to manage chronic conditions.,5000000.0,Pre-series B,Pre-seed,2021,Health Care
Earth Rhythm,Gurugram,Cosmetics,A mission to make customers healthier and Earth a little greener.,1200000.0,Seed,Seed,2021,Consumer Discretionary
Fountain9,Mumbai,Computer software,"Fountain9 is a Y Combinator backed company, which offers predictive inventory planning and optimization software for e-commerce, DTC and retail companies.",1900000.0,Seed,Seed,2021,Information Technology
Rockclimber,Bangalore,Food & Beverages,RockClimber is a new age beverage brand with a portfolio of alcoholic and non alcoholic drinks.,1000000.0,Seed,unknown,2021,Consumer Discretionary
SpEd@home,Mumbai,EdTech,"Provide Remediation, Occupational Therapy, Speech Therapy and Socio-emotional coaching for children with Learning Disabilities like Dyslexia, Dysgraphia, Dyscalculia",300000.0,Seed,unknown,2021,Information Technology
Green Soul,Ambernath,Consumer Goods,Green Soul is No.1 brand on Amazon India in Ergonomic chairs category in terms of customer reviews.,200000.0,Seed,unknown,2021,Consumer Discretionary
Shiprocket,New Delhi,Logistics,India's #1 eCommerce Logistics and Shipping Solution Empowering over 1 Lakh Indian eCommerce Sellers.,41000000.0,Series D,"Series B,C,D&E",2021,Industrial
DealShare,Bangalore,Retail,The next generation disruptive (social) e-commerce product for the masses.,144000000.0,Seed,unknown,2021,Consumer Discretionary
Teachmint,Bangalore,EdTech,Teachmint is an all-in-one education technology platform created specifically for the tutors of the digital age.,20000000.0,Pre-series B,Pre-seed,2021,Information Technology
Vahak,Bangalore,Transportation,Building India's Largest & Most Trusted Online Transport Marketplace & Directory,5000000.0,Pre-series A,Pre-seed,2021,Industrial
goSTOPS,New Delhi,Hospitality,goSTOPS aims to be India’s biggest and most loved backpacker hostel brand.,1000000.0,Pre-series A,Pre-seed,2021,Health Care
Powerplay,Bangalore,Construction,Powerplay helps simplify end to end Construction and Architecture project management.,5200000.0,Seed,unknown,2021,unknown
Delhivery,Gurugram,Logistics,"Delhivery is a supply chain services company that provides transportation, warehousing, freight, and order fulfillment services.",270000000.0,Series H,Others,2021,Industrial
Avishkaar,New Delhi,EdTech,India's leading Ed-Tech startup spearheading the Maker Revolution in the sub-continent,600000.0,Pre-series A,Pre-seed,2021,Information Technology
Jobsgaar,New Delhi,Job discovery platform,India's first District level/ Hyper Local Job discovery platform,140000.0,Seed,Seed,2021,unknown
Breathe Well-being,New Delhi,HealthCare,Breathe Wellbeing is an interactive and personalized platform that helps organization increase employee engagement and productivity.,1000000.0,Pre-series A,Pre-seed,2021,Health Care
Good Health Clinic,Hyderabad,HealthCare,Full Stack Digital Health Clinic,5000000.0,Seed,unknown,2021,Health Care
Urban Company,New Delhi,Home services,Urban Company is an India-based company providing a marketplace for freelance labor.,250000000.0,Series F,Others,2021,Consumer Discretionary
MYBYK,Ahmadabad,Rental,MYBYK is an app that provides premium bicycle sharing and rental service.,1000000.0,Pre-series A,Pre-seed,2021,Consumer Discretionary
Locus,Bangalore,Logistics,Locus is an intelligent decision-making and automation platform for logistics.,50000000.0,Series C,"Series B,C,D&E",2021,Industrial
Crejo.Fun,Bangalore,EdTech,Crejo.Fun is a digital extracurricular learning platform being built with an intent to help children discover their passions and interests through creative learning.,3000000.0,Seed,Seed,2021,Information Technology
Bambinos,Bangalore,EdTech,Cohort based extracurricular course for kids,500000.0,Seed,Seed,2021,Information Technology
KreditBee,Bangalore,FinTech,KreditBee is a digital lending platform developed to assist young professionals with their personal finances.,8000000.0,Seed,unknown,2021,Financials
Spardha,Pune,EdTech,"Spardha School Of Music, Spardha Academy, Spardha Online are associated marks with Spardha Learnings Private Limited.",400000.0,Pre-series A,Pre-seed,2021,Information Technology
Holisol,New Delhi,Logistics,HoliSol Logistics Is a Supply Chain Operations Company!,3000000.0,Seed,unknown,2021,Industrial
Now&Me,New Delhi,HealthCare,"Now&Me is a safe cocoon in the form of discussion forums, for you to let out your most intimate thoughts.",1000000.0,Seed,unknown,2021,Health Care
Fyllo,Bangalore,AgriTech,Fyllo brings farms on palms by installing on field devices and actions on top of this data.,400000.0,Seed,Seed,2021,Information Technology
Blaer Motors,Chennai,Mobility,Meant to augment human power and not completely replace it,300000.0,Seed,unknown,2021,Consumer Discretionary
Swiflearn,Gurugram,EdTech,Swiflearn provides online tuition classes to small batches to ensure personalised learning.,3000000.0,Pre-series A,Pre-seed,2021,Information Technology
QuickSell,Mumbai,E-commerce,B2B Mobile Commerce Platform,2000000.0,Pre-series A,Pre-seed,2021,Consumer Discretionary
Truemeds,Mumbai,Heathcare,Truemeds is a health-tech startup.,5000000.0,Series A,Series A,2021,unknown
Candes,New Delhi,E-commerce,Candes is a home appliances company providing a complete range of home & kitchen electrical appliances at affordable prices.,3000000.0,Seed,unknown,2021,Consumer Discretionary
MediBuddy,Bangalore,Heathcare,"MediBuddy is a digital healthcare platform for inpatient hospitalization, outpatient services, and corporate wellness benefits.",3000000.0,Seed,unknown,2021,unknown
F5,New Delhi,Food & Beverages,F5 is a foods and beverages company.,300000.0,Pre-series A,Pre-seed,2021,Consumer Discretionary
Capital Float,Bangalore,FinTech,Capital Float is an online platform that provides working capital finance to SMEs in India.,6000000.0,Seed,unknown,2021,Financials
IntelleWings,Panchkula,IT startup,"IntelleWings develops Sanctions & Anti-money laundering solutions with a clear, concise, and fresh perspective.",100000.0,Seed,Seed,2021,Information Technology
Shyplite,New Delhi,Logistics,Enable E-retailers to automate their logistics and increase efficiency in shipments by providing a single window shipping platform,1000000.0,Seed,unknown,2021,Industrial
Refyne,Bangalore,FinTech,Refyne partners with organisations to extend on-demand Earned Wage Access (EWA) to employees.,20000000.0,Series A,Series A,2021,Financials
Greenjoules,Pune,Renewable Energy,Greenjoules is a green energy technology startup that specializes in making renewable biofuels.,4500000.0,Series A,Series A,2021,Energy
MentorKart,New Delhi,Consulting,MentorKart™ helps to fulfil dreams and take that big step towards success.,150000.0,Seed,Seed,2021,Consumer Discretionary
Leverage Edu,New Delhi,EdTech,AI-enabled marketplace designed to help students with their higher education and career growth plans,2000000.0,Debt,Others,2021,Information Technology
Kale Logistics,Thane,Logistics,Kale Logistics Solutions is a global IT solutions provider focused on providing cutting-edge technology solutions to the Logistics industry.,5000000.0,Series A,Series A,2021,Industrial
CustomerGlu,Bangalore,CRM,CustomerGlu is a Low code Interactive Engagement platform to improve user stickiness.,320000.0,Seed,unknown,2021,Health Care
Cell Propulsion,Bangalore,EV startup,Cell Propulsion is a fleet electrification company developing solutions for large scale electrification of commercial vehicle fleets.,2000000.0,Seed,unknown,2021,Consumer Discretionary
Pee Safe,Gurugram,HealthCare,Redcliffe Hygiene Private Limited is India's fastest growing hygiene company.,3000000.0,Pre-series B,Pre-seed,2021,Health Care
Chqbook,New Delhi,FinTech,"Chqbook is a fintech startup that allows customers to explore, compare, book and get personal finance products.",1000000.0,Seed,unknown,2021,Financials
SimpliContract,Bangalore,Software,"SimpliContract is an Enterprise SaaS offering, focused on end to end Contract Life-cycle Management.",1800000.0,Seed,Seed,2021,Information Technology
Dropshop,Bangalore,Logistics,Building technology to make distribution efficient and cheaper for large and small FMCG companies,1000000.0,Pre-series A,Pre-seed,2021,Industrial
Jumbotail,Bangalore,E-commerce,Jumbotail is an operator of an online marketplace that simplifies food and grocery shopping.,4000000.0,Debt,Others,2021,Consumer Discretionary
BYJU'S,Bangalore,EdTech,BYJU'S is an educational technology company that develops personalized learning programs for K-12 students.,350000000.0,Seed,unknown,2021,Information Technology
Power Gummies,New Delhi,Nutrition,Power Gummies are a team of passionate givers who are dedicated to catering nutritional supplements,1000000.0,Seed,unknown,2021,Consumer Discretionary
Convosight,New Delhi,SaaS startup,A mission - to help community builders become community entrepreneurs.,9000000.0,Series A,Series A,2021,Information Technology
Junio,New Delhi,FinTech,Junio is a kids-focused digital pocket money-smart card.,600000.0,Seed,Seed,2021,Financials
Flexmoney,Mumbai,FinTech,"Flexmoney’s mission is to address the enormous digital credit market opportunity created by the disruption from e-commerce, EMI and BNPL checkout finance",4800000.0,Series A,Series A,2021,Financials
Fampay,Bangalore,FinTech,India's first numberless card and UPI without a bank account,38000000.0,Series A,Series A,2021,Financials
Apna,Bangalore,Human Resources,India's Professional App - Apna is dedicated to solving the problem of unemployment at the grassroot level,70000000.0,Series B,"Series B,C,D&E",2021,unknown
XYXX Apparels,Surat,Fashion,"XYXX Apparels,which runs an eponymous innerwear brand",4000000.0,Series A,Series A,2021,Consumer Discretionary
BrowserStack,Mumbai,SaaS startup,BrowserStack is a leading software testing platform powering over two million tests every day across 15 global data centres.,200000000.0,Series B,"Series B,C,D&E",2021,Information Technology
Vital,New Delhi,Insuretech,"An affordable, digital health plan built around to cover both big and small expenses",3000000.0,Pre-series A,Pre-seed,2021,unknown
Samaaro,Bangalore,SaaS startup,"Samaaro is a virtual event platform designed to help organizations host scalable, secure, and effective virtual events for a global audience",125000.0,Seed,unknown,2021,Information Technology
Imagimake,Mumbai,Innovation management,An innovative play system to help children create their imagination,500000.0,Pre-series A,Pre-seed,2021,Information Technology
MSMEx,Andheri,EdTech,MSMEx connects micro and small Business Owners with curated Business Experts over live video.,1000000.0,Pre-series A,Pre-seed,2021,Information Technology
RenewBuy,Gurugram,Insuretech,Simplest way to renew car insurance. Get quote and insure car in couple of minutes,45000000.0,Series C,"Series B,C,D&E",2021,unknown
Kutumb,Bangalore,Community platform,Kutumb is a social community enabler.,26000000.0,Series A,Series A,2021,Communication Services
Superplum,Noida,AgriTech,Building India's most sophisticated platform for high quality fresh food,3800000.0,Pre-series A,Pre-seed,2021,Information Technology
Upside AI,Mumbai,FinTech,Upside AI on the thesis that technology will make better investing decisions than humans over the long term.,1200000.0,Seed,Seed,2021,Financials
Skillmatics,Mumbai,EdTech,Skillmatics develops learning games for pre-school and primary school kids aged under 10,6000000.0,Series A,Series A,2021,Information Technology
Bimaplan,Bangalore,Insuretech,Affordable insurance for the next billion Indians,2500000.0,Pre-series A,Pre-seed,2021,unknown
Bueno Finance,Gurugram,FinTech,"Bueno Gig Growth Technologies Pvt Ltd (""Bueno Finance"") is a financial services platform which aims is to help improve the financial health of customers.",3000000.0,Seed,Seed,2021,Financials
