Company_Brand,HeadQuarter,Sector,What_it_does,Amount,Stage,Stage_category,Funding_year,Sector_category
ApplicateAI,Gurugram,Information Technology & Services,"‘ApplicateAI’ is an integrated AI BOT platform for Enterprise with defined and curated work-flows for Sales, Consumer Engagement and Employee support and engagement.",30000000.0,Series A,Series A,2021,Information Technology
VLCC Health Care,Gurugram,Health,VLCC is today widely recognized for its comprehensive portfolio of beauty and wellness products and services,4000000.0,Seed,unknown,2021,Health Care
Duroflex,Bangalore,Furniture,"5 decades of experience, superior quality and best in class innovation help us in bringing you a wide range of mattresses, pillows, protectors and other sleep solutions.",60000000.0,Seed,unknown,2021,unknown
Aviom India,Bhilwara,Financial Services,AVIOM India Housing Finance Pvt. Ltd. is a venture started by experienced professionals with a vision to improve the standard of living of families from the informal sector in rural areas,8000000.0,Series C,"Series B,C,D&E",2021,Financials
Onato,Bangalore,Computer Software,A startup solving inefficiencies in the agri supply chain,2200000.0,Seed,unknown,2021,Information Technology
Mestastop Solutions,Bangalore,Biotechnology,"Mestastop aims to provide a solution for such challenges with their unique proprietary platforms, METAssay, METSCAN, and METVivo.",100000.0,Seed,unknown,2021,Health Care
SaaS Labs,Noida,SaaS,"Building high impact communication, workflow and productivity tools for sales and support teams throughout the globe.",17000000.0,Series A,Series A,2021,unknown
Devnagri,Noida,Translation & Localization,"Devnagri is an AI powered human translation platform, working in all 22 Indian languages.",600000.0,Seed,Seed,2021,unknown
CRED,Bangalore,Finance,CRED is a credit card payment platform that rewards users with points for paying their bills.,250000000.0,Series E,"Series B,C,D&E",2021,Financials
ConveGenius,Noida,Education Management,An EdTech social enterprise focused on closing the gap in educational achievement for children and youth in India.,5000000.0,Pre-seed,Pre-seed,2021,Consumer Discretionary
Totality,Gurugram,Entertainment,"Totality with the goal of combining scalability through technology, innovation through design & retention through content.",1000000.0,Seed,unknown,2021,Consumer Discretionary
CredAble,Mumbai,Financial Services,CredAble provides liquidity programs for enterprise supply chains.,30000000.0,Series B,"Series B,C,D&E",2021,Financials
MarketWolf,Mumbai,Financial Services,"MarketWolf provides everyone an opportunity to begin their trading journey with a unique digital platform that is bold, simple and fun.",5500000.0,Seed,Seed,2021,Financials
Wondrlab,Mumbai,Marketing & Advertising,India's largest platform-first martech startup,7000000.0,Pre-series A,Pre-seed,2021,Consumer Discretionary
SUN Mobility,Bangalore,Automotive,Provider of universal energy infrastructure and services to accelerate mass EV usage!,50000000.0,Seed,unknown,2021,unknown
Tamasha,Mumbai,Entertainment,"Tamasha, the next-generation interactive entertainment platform.",3000000.0,Pre-series A,Pre-seed,2021,Consumer Discretionary
Revfin,New Delhi,Financial Services,"RevFin is a financial technology (FinTech) company, advanced digital lending platform makes getting a loan convenient and accessible for customers",4000000.0,Pre-series A,Pre-seed,2021,Financials
Yu Foodlabs,Gurugram,Food & Beverages,Re-imagining Packaged Foods with Natural Ingredients & ZERO Preservatives,1000000.0,Pre-series A,Pre-seed,2021,Consumer Discretionary
MergerDomo,New Delhi,Investment Banking,MergerDomo is the one-stop Global OnLine M&A marketplace for Corporate and Business Growth,500000.0,Seed,unknown,2021,Financials
FarMart,Gurugram,Farming,FarMart is an agritech platform that helps businesses easily source high quality produce at reasonable prices.,10000000.0,Series A,Series A,2021,unknown
Questt,Gurugram,EdTech,Questt is a Free online homework app that lets teachers assign gamified homework to students.,6750000.0,Series A,Series A,2021,Information Technology
IDfy,Mumbai,Information Technology & Services,IDfy helps people and business build authentic relationships by ensuring that both parties are who they claim to be and can be trusted.,10000000.0,Series D,"Series B,C,D&E",2021,Information Technology
ClearDekho,Ghaziabad,Retail,ClearDekho is India’s Leading Affordable Eyewear Brand.,4000000.0,Pre-series A,Pre-seed,2021,Consumer Discretionary
BookingJini,Gurugram,Hospitality,BookingJini strive to empower Hotels from all aspects ranging from customer outreach to automate their booking process and improve their online presence and revenue to stimulate Top-line and Bottom-line growth.,1200000.0,Pre-series A,Pre-seed,2021,Health Care
Sourcewiz,Gurugram,Information Technology & Services,Building a platform for exporters to digitize their workflows and help them grow and manage their business.,3000000.0,Seed,Seed,2021,Information Technology
Tvasta,Chennai,Mechanical Or Industrial Engineering,Developing new-age manufacturing and automation technologies that can increase human productivity by allowing deep personalization.,400000.0,Seed,unknown,2021,Industrial
Kafqa Academy,Bangalore,E-learning,"Kafqa Academy is a global performing arts academy that offers classes in dancing, singing, and speech & drama.",1300000.0,Seed,Seed,2021,unknown
Trell,Bangalore,Social commerce,Trell is turning over a new leaf with the wave of digitalization sweeping across the nation,100000000.0,Seed,unknown,2021,unknown
Storia,Mumbai,Food & Beverages,"Storia Foods and Beverages is committed to creating products that are natural, full of goodness and promote a healthy lifestyle.",6000000.0,Series A,Series A,2021,Consumer Discretionary
Clear,Bangalore,Computer Software,India’s leading FinTech SaaS platform,75000000.0,Series C,"Series B,C,D&E",2021,Information Technology
Groww,Bangalore,Finance,Groww is on a mission to democratize access to financial services for millions of Indians responsibly.,250000000.0,Series E,"Series B,C,D&E",2021,Financials
The Indus Valley,Chennai,Consumer Goods,Consumer GoodsThe Indus Valley is a Direct to Consumer (D2C) healthy kitchenware brand.,1100000.0,Seed,unknown,2021,Consumer Discretionary
BharatPe,New Delhi,Financial Services,"BharatPe launched India’s first UPI interoperable QR code, first ZERO MDR payment acceptance service, and first UPI payment backed merchant cash advance service.",10000000.0,Seed,unknown,2021,Financials
Teachmint,Bangalore,E-learning,Teachmint is an education infrastructure provider and India’s largest teaching platform.,78000000.0,Series B,"Series B,C,D&E",2021,unknown
Porter,Bangalore,Logistics & Supply Chain,Porter is India's Largest Marketplace for Intra-City Logistics.,100000000.0,Series E,"Series B,C,D&E",2021,Industrial
O4S,Gurugram,Information Technology & Services,O4S SaaS helps Consumer Brands to Digitize and Automate their Supply Chain thereby increasing Sales and Performance.,6000000.0,Series A,Series A,2021,Information Technology
Wobb,Gurugram,Marketing,The platform for marketers to find and work with influencers,200000.0,Pre-seed,Pre-seed,2021,Consumer Discretionary
BASIC Home Loan,Gurugram,Financial Services,BASIC Home Loan is India's first automated platform for secured lending with special focus on the affordable housing segment.,3500000.0,Series A,Series A,2021,Financials
Siply,Bangalore,Financial Services,"A tech-enabled micro-savings platform, for the underserved masses, that makes it possible to save starting at Re. 1",3200000.0,Pre-series A,Pre-seed,2021,Financials
BankSathi,New Delhi,Financial Services,"BankSathi is a Fintech platform to empower consumers to save money and time on financial products through safe, easy, and trustable shopping experience.",500000.0,Seed,unknown,2021,Financials
Gramophone,Indore,AgriTech,"Create a difference in farming by bringing timely information, technology and right kind of inputs to achieve better yields for farmers.",10000000.0,Seed,unknown,2021,Information Technology
Healofy,Bangalore,Femtech,Healofy was created with a mission to experience special motherhood through its products and its inexhaustive and evergrowing babycare tips,6000000.0,Series B,"Series B,C,D&E",2021,Health Care
E42,Pune,Computer Software,E42 is the world’s leading Natural Language Processing- based AI platform driving enterprise cognition across processes.,5400000.0,Series A,Series A,2021,Information Technology
Spottabl,Bangalore,Human Resources,Spottabl is a technology driven recruitment platform that has helped over 50 tech startups and growth stage companies discover their top talent through its intelligent and human backed model.,400000.0,Seed,Seed,2021,unknown
DeHaat,Gurugram,Information Technology & Services,DeHaat™ is one of the fastest growing start-ups in Agri Tech sector and one of the very few companies providing end-to-end solutions and services to the farming community in India.,115000000.0,Series D,"Series B,C,D&E",2021,Information Technology
Zolve,Bangalore,Financial Services,World's first cross-border Neobank,40000000.0,Series A,Series A,2021,Financials
Instoried,Bangalore,Computer Software,"The platform helps content writers in e-commerce, news, FMCG, and other verticals to optimize emotions in their marketing content.",8000000.0,Seed,unknown,2021,Information Technology
SportZchain,Mumbai,sports,SportZchain is India's first blockchain based platform poised to disrupt a multi-billion dollar fan engagement industry.,400000.0,Pre-seed,Pre-seed,2021,unknown
Hypto,Chennai,Tech startup,The next generation of web services that democratize access to finance for developers and businesses.,3000000.0,Seed,Seed,2021,Information Technology
CHUPPS,Mumbai,Foootwear,D2C footwear brand,1100000.0,Pre-series A,Pre-seed,2021,unknown
Zenduty,Bangalore,Computer Software,"Next-generation end-to-end incident response platform for SREs, DevOps, ITOps and Support teams",1900000.0,Pre-series A,Pre-seed,2021,Information Technology
R for Rabbit,Ahmedabad,Consumer Goods,The concept of R for Rabbit was conceived after the founder of the company was blessed with a baby.,5000000.0,Seed,unknown,2021,Consumer Discretionary
Acko,Bangalore,Insurance,ACKO is India’s first and fastest growing InsurTech company which makes buying and using insurance effortless.,255000000.0,Series D,"Series B,C,D&E",2021,unknown
LoveLocal,Mumbai,Retail,LoveLocal (formerly known as m.Paani) is bringing Trusted Local Shops Online and empowering them to deliver the neighbourhood shopping experience of the future.,18000000.0,Pre-series B,Pre-seed,2021,Consumer Discretionary
SupplyNote,Noida,Food & Beverages,"SupplyNote is Cloud based web and mobile enabled suite connecting outlets, service providers and suppliers.",1200000.0,Pre-series A,Pre-seed,2021,Consumer Discretionary
Vakilsearch,Chennai,Legal Services,"India's largest Legal, Compliance & Tax services platform, and trusted partner in making legal simple!",10000000.0,Seed,unknown,2021,Consumer Discretionary
Cloudphysician,Bangalore,Hospital & Health Care,Cloudphysician is a healthtech company that is transforming the delivery of critical care.,4000000.0,Pre-series A,Pre-seed,2021,Health Care
Wiggles.in,Pune,Veterinary,Wiggles India is a preventative healthcare brand for all things pets!,5500000.0,Pre-series A,Pre-seed,2021,Health Care
Avanti Finance,Bangalore,Financial Services,A digital platform to make financial services accessible to 100 million unserved and underserved households across India,15000000.0,Series A,Series A,2021,Financials
Vanity Wagon,New Delhi,Consumer Goods,Vanity Wagon is India's first true information oriented clean beauty marketplace.,700000.0,Pre-series A,Pre-seed,2021,Consumer Discretionary
Purplle,Mumbai,E-commerce,Purplle.com is one of India’s largest e-beauty destinations with more than 7 million monthly active users.,70000000.0,Seed,unknown,2021,Consumer Discretionary
MFine,Bangalore,Hospital & Health Care,"MFine aims to make access to trusted healthcare simple, fast, and effective.",48000000.0,Series C,"Series B,C,D&E",2021,Health Care
Mentza,Mumbai,E-learning,"Make great conversations accessible to everyone through a vibrant, small, safe, and easy real-time audio platform",400000.0,Seed,Seed,2021,unknown
ConnectedH,Gurugram,Hospital & Health Care,Connect different sectors of healthcare system and give the patients complete control over their information.,2300000.0,Seed,Seed,2021,Health Care
CredAvenue,Chennai,FinTech,CredAvenue is an organization on a mission to deepen and power the $120Trillion global enterprise debt market which would unlock a GDP multiplier and thus create massive economic value.,90000000.0,Series A,Series A,2021,Financials
Vedantu,Bangalore,E-learning,Vedantu is a LIVE online learning platform that brings together students and teachers to achieve best results.,100000000.0,Series E,"Series B,C,D&E",2021,unknown
Exotel,Bangalore,Telecommunications,"Asia's largest customer engagement platform, streamlining customer interactions for Swiggy, Ola, Flipkart, GoJek etc.",35000000.0,Series C,"Series B,C,D&E",2021,Information Technology
Fantasy Akhada,Gurugram,sports,Fantasy Akhada is one of India's fastest growing Fantasy Sports Platform.,2000000.0,Series A,Series A,2021,unknown
Meesho,Bangalore,Social commerce,Meesho is India’s largest marketplace for longtail products.,570000000.0,Seed,unknown,2021,unknown
Cusmat,Hyderabad,Computer Software,CUSMAT is India’s largest immersive skilling and training platform.,100000.0,Pre-series A,Pre-seed,2021,Information Technology
Homeville,Mumbai,Information Technology & Services,A technology company focused on helping people buy their first home with down payment assistance at zero interest cost.,7000000.0,Seed,unknown,2021,Information Technology
Coinshift,Chandigarh,Blockchain,CoinShift helps businesses and decentralised autonomous organisations (DAO's) manage their crypto easily,2500000.0,Seed,Seed,2021,unknown
Strip Finance,Hyderabad,Financial Services,Collateralised NFT & DeFi Liquidity Protocol With Interest Rate Discovery.,400000.0,Seed,Seed,2021,Financials
Ola Electric,Bangalore,Automotive,Charging ahead to accelerate the world’s transition to sustainable mobility.,200000000.0,Seed,unknown,2021,unknown
Kolo,Bangalore,Construction,Home construction app for finding ideas and service providers near you,550000.0,Pre-seed,Pre-seed,2021,unknown
Chqbook,Gurugram,FinTech,"Chqbook.com is India’s first neobank for small business owners offering world-class financial services through its five pillars of banking, khata, lending, insurance, and rewards.",5000000.0,Pre-series B,Pre-seed,2021,Financials
EV Plugs,Gurugram,Information Technology & Services,EV charging station aggregator platform,150000.0,Seed,unknown,2021,Information Technology
Rulezero,Bangalore,Financial Services,"Rulezero is a legal/fintech startup reimagining private markets by building an intelligent platform that enables stakeholder participation and capital flow in a transparent, efficient and compliant manner.",2500000.0,Seed,Seed,2021,Financials
CredRight,Hyderabad,Financial Services,"CredRight is a new age digital lending company 100% focused on Micro & Small businesses, making the process of availing loans simple",2700000.0,Seed,unknown,2021,Financials
Karbon Card,Bangalore,FinTech,"Empower Indian startups by creating the right financial products starting with a high-limit corporate credit card with unlimited benefits, no personal liability and no fixed deposit.",12000000.0,Pre-series A,Pre-seed,2021,Financials
Auntie Fung,Bangalore,Food & Beverages,Serving delectable and eclectic pan-Asian fare to all foodies in a quick-service & healthy format,400000.0,Seed,unknown,2021,Consumer Discretionary
ePayLater,Mumbai,Financial Services,ePaylater is a payment solution that aims to separate the experience of shopping from the hassles of payment process.,10000000.0,Series B,"Series B,C,D&E",2021,Financials
Fittr,Pune,Health,"FITTR’s mission is to reach out to 50 million people and make them fit, create jobs in the fitness industry, teach people how easy it is to stay fit and move together as a Wolfpack.",11000000.0,Series A,Series A,2021,Health Care
Medikabazaar,Mumbai,Healthtech,"Medikabazaar, India’s pioneering and largest online B2B marketspace for medical supplies and equipment.",75000000.0,Series C,"Series B,C,D&E",2021,Health Care
Delhivery,Gurugram,Logistics & Supply Chain,Delhivery is a leading logistics and supply chain services company in India.,125000000.0,Seed,unknown,2021,Industrial
Akudo,Bangalore,Financial Services,A Learning-First Neobank for teenagers - Enable practical financial education for child today,4200000.0,Seed,Seed,2021,Financials
Sanctum Wealth,Mumbai,Investment Management,Sanctum is an Indian wealth management firm which has acquired RBS India’s Private Banking business.,10000000.0,Seed,unknown,2021,Financials
88academics,New Delhi,Education,88academics an 88tuition Pte Ltd has been established with the social objective of making quality video-based learning material available to all students.,3000000.0,Pre-series A,Pre-seed,2021,Consumer Discretionary
Sanfe,New Delhi,Health,India’s revolutionary feminine hygiene and period care brand that strives to build a better world for women.,1000000.0,Series A,Series A,2021,Health Care
PredictiVu,Gurugram,Management Consulting,"PredictiVu's AI-enabled dashboard integrated with India's largest, proprietary, weekly consumer purchase data, market intelligence and web insights",1500000.0,Pre-seed,Pre-seed,2021,Consumer Discretionary
Sterling Accuris Wellness,Ahmedabad,Hospital & Health Care,"STERLING ACCURIS WELLNESS PRIVATE LIMITED is a hospital & health care company based out of 3-FLOOR HERITAGE COMPLEX, NR.",30000000.0,Seed,unknown,2021,Health Care
Bijnis,New Delhi,B2B startup,Bijnis is revolutionizing the way manufacturers operate and scale their factories by digitizing their Demand/Supply/Captial/Operations.,30000000.0,Series B,"Series B,C,D&E",2021,unknown
Capital Float,Bangalore,Financial Services,India's leading BNPL and digital credit platform serving millions of aspirational individuals.,50000000.0,Seed,unknown,2021,Financials
Manch Technologies,Bangalore,Information Technology & Services,"A Single Click Work Flow E-Sign solution to conduct speedy, accurate, efficient transactions through a “cash-less, presence-less, paperless” framework.",1000000.0,Pre-series A,Pre-seed,2021,Information Technology
Glamyo Health,New Delhi,Hospital & Health Care,Glamyo Health is an advanced healthcare co delivering a seamless experience for elective surgeries.,3000000.0,Series A,Series A,2021,Health Care
CashBook,Gurugram,FinTech,"CashBook is a digital record-keeping app using which businesses can add entries, segregate records, and find overall balance instantly.",2300000.0,Seed,Seed,2021,Financials
The Money Club,Noida,Financial Services,The Money Club is a mobile platform for peer to peer chit funds.,1700000.0,Pre-series A,Pre-seed,2021,Financials
SuperZop,Mumbai,Retail,SuperZop is India's first and only vernacular B2B Grocery e-commerce platform that is transforming the unorganized retail sector.,4000000.0,Series A,Series A,2021,Consumer Discretionary
Zypp Electric,Gurugram,Logistics & Supply Chain,"Zypp is working to convert all deliveries for e-commerce, grocery, medicine and food vertical to go electric with e-scooter sharing app.",7000000.0,Series A,Series A,2021,Industrial
Alpha Coach,Mumbai,Professional Training & Coaching,One to One Personal Fitness Coaching,1200000.0,Seed,unknown,2021,Industrial
VRO Hospitality,Bangalore,Hospitality,One of the fastest-growing hospitality companies based out of Bangalore.,3000000.0,Series A,Series A,2021,Health Care
byteXL,Hyderabad,E-learning,"ByteXL is the first-ever, one-stop-shop for self-learning course work and guided training – preparing a new generation of coders for the workforce.",200000.0,Seed,unknown,2021,unknown
Leena AI,Gurugram,Computer Software,AI to help enterprises transform the employee experience.,30000000.0,Series B,"Series B,C,D&E",2021,Information Technology
CARS24,Gurugram,Automotive,"CARS24 is proud to be a tech-first organisation, looking to make inroads into the global auto-tech market in groundbreaking ways.",450000000.0,Series F,Others,2021,unknown
Klub,Bangalore,Financial Services,"A team of fintech, investment banking, venture capital, and technology veterans who bring a founder-first mindset.",2000000.0,Debt,Others,2021,Financials
Bluepad,Bangalore,Online Media,A one-stop solution for aggregated content  in vernacular languages,200000.0,Pre-seed,Pre-seed,2021,Consumer Discretionary
FloBiz,Bangalore,Information Technology & Services,Neobank for Growing SMBs. Simplify GST Billing & Accounting needs with myBillBook App.,31000000.0,Series B,"Series B,C,D&E",2021,Information Technology
Tummoc,Bangalore,Mobility,Tummoc helps track and find actionable & accurate bus/metro/suburban rail intracity travel information.,540000.0,Seed,Seed,2021,Consumer Discretionary
Design Cafe,Bangalore,Design,Design Cafe is on a mission to democratize good design for homes in India.,25000000.0,Seed,unknown,2021,Consumer Discretionary
Aerchain,Bangalore,Computer Software,Advance Source-to-Pay cycle to a new level with Artificial Intelligence!,3000000.0,Pre-series A,Pre-seed,2021,Information Technology
CuriousJr,Gurugram,E-learning,CuriousJr is a platform to answer kids' curiosity and prepare them for 21st-century skills.,1000000.0,Seed,Seed,2021,unknown
Wow! Momo,Kolkata,Food & Beverages,WOW! Momo is one of the fastest-growing food brands in India.,15000000.0,Series C,"Series B,C,D&E",2021,Consumer Discretionary
Supertails,Bangalore,Consumer Services,Supertails is building a digital pet care platform which offers expert led healthcare services and products.,700000.0,Seed,unknown,2021,Consumer Discretionary
LifeCell,Chennai,Biotechnology,A building block of the team that preserves the building blocks of life,30000000.0,Seed,unknown,2021,Health Care
ZestMoney,Bangalore,Financial Services,"ZestMoney helps make it accessible for millions to upgrade, to enhance, to rise, while keeping it affordable.",50000000.0,Series C,"Series B,C,D&E",2021,Financials
FrontRow,Bangalore,E-learning,"FrontRow enables everyone to pursue their passions - get better, learn from the best and get noticed!",14000000.0,Series A,Series A,2021,unknown
HappyCredit,Bangalore,FinTech,"HappyCredit is on a mission to make online shopping delightful for 400mn bharat shoppers with credit, rewards, shopping inspiration and more.",600000.0,Pre-seed,Pre-seed,2021,Financials
Endimension,Mumbai,Healtcare,Endimension Technology is a healthcare Artificial Intelligence startup incubated at IIT Bombay.,300000.0,Seed,Seed,2021,unknown
BeepKart,Bangalore,Automotive,BeepKart is building a platform to digitize and organize the used two-wheeler market.,3000000.0,Seed,Seed,2021,unknown
Lio,Pune,Computer Software,"Lio is the one app for all data where you can create, keep records and track all the records",5000000.0,Seed,Seed,2021,Information Technology
TravClan,New Delhi,B2B Travel,A mission to solve a genuine problem faced by millions of travel entrepreneurs across the world.,2200000.0,Pre-series A,Pre-seed,2021,Consumer Discretionary
WickedGud,Mumbai,Food & Beverages,A mission to make every day eating guilt-free and change the way the world consumes comfort foods.,340000.0,Pre-seed,Pre-seed,2021,Consumer Discretionary
Enercomp,Ahmedabad,Information Technology & Services,Enercomp Solutions Pvt Ltd provide drone based economically viable solutions for different sectors to improve efficiency and accuracy.,200000.0,Seed,unknown,2021,Information Technology
BetterPlace,Bangalore,Information Technology & Services,"BetterPlace is India’s largest technology platform delivering digital solutions for blue-collar workforce management, throughout the entire value chain.",24000000.0,Series C,"Series B,C,D&E",2021,Information Technology
Medpho,Noida,Hospital & Health Care,Medpho is a healthcare service provider in India that connects doctors and patients at the click of a call.,1000000.0,Seed,unknown,2021,Health Care
LivQuik Technology,Mumbai,Financial Services,LivQuik’s vision is to enable the efficient movement of money.,4000000.0,Seed,unknown,2021,Financials
GTM Buddy,Hyderabad,Computer Software,Just-in-time Sales Enablement Platform,2000000.0,Seed,Seed,2021,Information Technology
Gobbly,Gurugram,Retail,A 24x7 automated retail store filled with daily essentials.,900000.0,Pre-series A,Pre-seed,2021,Consumer Discretionary
HexaHealth,Mumbai,Healthtech,H2D is the most trusted online platform that connects the finest experts with people aspiring to achieve their Health Goals in a holistic way,4500000.0,Seed,Seed,2021,Health Care
Eupheus Learning,New Delhi,E-learning,Offer pedagogically differentiated technology driven solutions that lead to critical thinking and achievement of higher learning outcomes,10000000.0,Series C,"Series B,C,D&E",2021,unknown
Easiloan,Mumbai,FinTech,"A Fintech startup, offering fast & easy digital processing of Home Loans in a completely reimagined and delightful way.",1000000.0,Seed,unknown,2021,Financials
Anar,Mumbai,Information Technology & Services,Anar Business Community App is a platform where businesses can create their free profile and grow their business network all over India.,6200000.0,Seed,Seed,2021,Information Technology
Shadez,Mumbai,Consumer Services,"Smart painting process, latest automatic tools and professional painters make the process faster than any other conventional process of painting .",200000.0,Pre-series A,Pre-seed,2021,Consumer Discretionary
